{
  "$schema": "ops/schemas/raw-markdown-normalization-report.schema.json",
  "vault": ".",
  "generated_at": "2026-04-15T13:40:35.824831Z",
  "policy": {
    "path": "ops/policies/wiki-maintainer-policy.yaml",
    "version": 4
  },
  "mode": "write",
  "target_path": "raw",
  "stats": {
    "file_count": 111,
    "changed_count": 67,
    "manual_review_count": 1
  },
  "results": [
    {
      "path": "raw/web-snapshots/'5부 능선' 넘은 AI데이터센터 특별법…기후부와 전력 특례 조율 '쟁점'.md",
      "changed": true,
      "frontmatter_present_before": true,
      "pre_sha256": "315dd4c41cbb4625efdafc092b48374fd6c1f66df966eb5dda0f45a38d8f9268",
      "post_sha256": "8a2849d24ed64547bf68488e20e8d386fbb753c16a0ff4744a04079381bc57e3",
      "metadata": {
        "title": "'5부 능선' 넘은 AI데이터센터 특별법…기후부와 전력 특례 조율 '쟁점'",
        "source": "https://n.news.naver.com/mnews/article/003/0013887345",
        "author": null,
        "published": "unknown",
        "created": "2026-04-15",
        "description": "심지혜 박은비 기자 = 인공지능(AI) 강국 도약을 위한 핵심 인프라인 ‘인공지능 데이터센터(AIDC)’ 구축의 법적 근거가 될 특별법이 국회 과학기술정보방송통신위원회를 통과했다. 수도권에 집중된 데이터센터를 지역으",
        "tags": [
          "clippings"
        ]
      },
      "removed_noise_classes": [],
      "manual_review_required": false,
      "manual_review_reasons": []
    },
    {
      "path": "raw/web-snapshots/2차 종전 협상 관측 속 원달러 환율 이틀째 하락…1,474.2원.md",
      "changed": true,
      "frontmatter_present_before": true,
      "pre_sha256": "3b795c2a9d1e5020531d8f399c9ba2d1687fb379aa8af504e4d9c1eae265ea51",
      "post_sha256": "449e48c5ab69ba28ea1701a6fe4c48a194b16bfe7b348906d2fe315938986df0",
      "metadata": {
        "title": "2차 종전 협상 관측 속 원/달러 환율 이틀째 하락…1,474.2원",
        "source": "https://n.news.naver.com/mnews/article/001/0016023514",
        "author": null,
        "published": "unknown",
        "created": "2026-04-15",
        "description": "중동 전쟁 종료를 위한 미국과 이란의 2차 협상이 열릴 것이라는 기대감 속에 원/달러 환율이 이틀 연속 내렸다. 15일 서울 외환시장에서 미국 달러화 대비 원화 환율의 주간 거래 종가(오후 3시 30분 기준)는 전",
        "tags": [
          "clippings"
        ]
      },
      "removed_noise_classes": [],
      "manual_review_required": false,
      "manual_review_reasons": []
    },
    {
      "path": "raw/web-snapshots/AI in Search is driving more queries and higher quality clicks.md",
      "changed": false,
      "frontmatter_present_before": true,
      "pre_sha256": "f7dbbef1b07581257b59a96276db68e918b5a8e8ebe44b50d31c1cbc8b010890",
      "post_sha256": "f7dbbef1b07581257b59a96276db68e918b5a8e8ebe44b50d31c1cbc8b010890",
      "metadata": {
        "title": "AI in Search is driving more queries and higher quality clicks",
        "source": "https://blog.google/products-and-platforms/products/search/ai-search-driving-more-queries-higher-quality-clicks/",
        "author": [
          "[[Liz Reid]]"
        ],
        "published": "2025-08-07",
        "created": "2026-04-14",
        "description": "We continue to send billions of clicks to the web every day and are committed to prioritizing the web in our AI experiences in Search.",
        "tags": [
          "clippings"
        ]
      },
      "removed_noise_classes": [],
      "manual_review_required": false,
      "manual_review_reasons": []
    },
    {
      "path": "raw/web-snapshots/AI에 프리미어리그 베팅 시켜봤더니…대부분 파산.md",
      "changed": true,
      "frontmatter_present_before": true,
      "pre_sha256": "e200556eeed8e5cb21e643c0534596f0948775e55605d074cbdd7e5dd08fbdba",
      "post_sha256": "2b0be0b84dc5a4353343fb4f4ed718a9cab393c7338d0379b3252fcdaf11e0cb",
      "metadata": {
        "title": "AI에 프리미어리그 베팅 시켜봤더니…\"대부분 파산\"",
        "source": "https://n.news.naver.com/mnews/article/029/0003021186",
        "author": null,
        "published": "unknown",
        "created": "2026-04-13",
        "description": "주요 인공지능(AI) 모델들이 잉글랜드 프리미어리그 축구 모의 베팅에서 모두 손실을 기록했다는 연구 결과가 나왔다. 11일(현지시간) 영국 런던의 AI 스타트업 제너럴리즈닝이 공개한 '켈리벤치' 논문에 따르면 202",
        "tags": [
          "clippings"
        ]
      },
      "removed_noise_classes": [],
      "manual_review_required": false,
      "manual_review_reasons": []
    },
    {
      "path": "raw/web-snapshots/An Open-Ended Embodied Agent with Large Language Models.md",
      "changed": true,
      "frontmatter_present_before": true,
      "pre_sha256": "881b16111ca820452498fcf2dd1fcfaf4d1daab0fc6208c262fc402d510a24b7",
      "post_sha256": "4ba9a6a4e48b011cef2c21da74f97c218556a0a9d8dc9a7a121ba98f1bc5c3bb",
      "metadata": {
        "title": "An Open-Ended Embodied Agent with Large Language Models",
        "source": "https://voyager.minedojo.org/",
        "author": null,
        "published": "unknown",
        "created": "2026-04-13",
        "description": null,
        "tags": [
          "clippings"
        ]
      },
      "removed_noise_classes": [],
      "manual_review_required": false,
      "manual_review_reasons": []
    },
    {
      "path": "raw/web-snapshots/Anthropic expands partnership with Google and Broadcom for multiple gigawatts of next-generation compute.md",
      "changed": true,
      "frontmatter_present_before": true,
      "pre_sha256": "9411b78c78df3f481d382b65e2a271874384683a76e80b957672e3155b29f5f8",
      "post_sha256": "45f4a1ded81400622c8c240e758512238d33e80b612d31e997c1acaf80a5606f",
      "metadata": {
        "title": "Anthropic expands partnership with Google and Broadcom for multiple gigawatts of next-generation compute",
        "source": "https://www.anthropic.com/news/google-broadcom-partnership-compute",
        "author": null,
        "published": "unknown",
        "created": "2026-04-15",
        "description": "Anthropic is an AI safety and research company that's working to build reliable, interpretable, and steerable AI systems.",
        "tags": [
          "clippings"
        ]
      },
      "removed_noise_classes": [],
      "manual_review_required": false,
      "manual_review_reasons": []
    },
    {
      "path": "raw/web-snapshots/Anthropic's Claude Mythos isn't a sentient super-hacker, it's a sales pitch — claims of 'thousands' of severe zero-days rely on just 198 manual reviews.md",
      "changed": false,
      "frontmatter_present_before": true,
      "pre_sha256": "c33fbcab1d67f806dc755e1c250e498a440892143fa48d141d6ef83e7bfd11e6",
      "post_sha256": "c33fbcab1d67f806dc755e1c250e498a440892143fa48d141d6ef83e7bfd11e6",
      "metadata": {
        "title": "Anthropic's Claude Mythos isn't a sentient super-hacker, it's a sales pitch — claims of 'thousands' of severe zero-days rely on just 198 manual reviews",
        "source": "https://www.tomshardware.com/tech-industry/artificial-intelligence/anthropics-claude-mythos-isnt-a-sentient-super-hacker-its-a-sales-pitch-claims-of-thousands-of-severe-zero-days-rely-on-just-198-manual-reviews",
        "author": [
          "[[Jon Martindale]]"
        ],
        "published": "2026-04-10",
        "created": "2026-04-12",
        "description": "Many of the \"thousands\" of bugs and vulnerabilities it found are in older software, or are impossible to exploit.",
        "tags": [
          "clippings"
        ]
      },
      "removed_noise_classes": [],
      "manual_review_required": false,
      "manual_review_reasons": []
    },
    {
      "path": "raw/web-snapshots/Anthropic’s Long-Term Benefit Trust appoints Vas Narasimhan to Board of Directors.md",
      "changed": true,
      "frontmatter_present_before": true,
      "pre_sha256": "b3d41b35e7fd4b6e93bbf0df34d87b2c955d264b6dac21ef38becd8f28895a93",
      "post_sha256": "42c5afacb2d5d0f7e05b700684d84eeeb0bc83fce777033bde3fd90783b83aa7",
      "metadata": {
        "title": "Anthropic’s Long-Term Benefit Trust appoints Vas Narasimhan to Board of Directors",
        "source": "https://www.anthropic.com/news/narasimhan-board",
        "author": null,
        "published": "unknown",
        "created": "2026-04-15",
        "description": "Anthropic is an AI safety and research company that's working to build reliable, interpretable, and steerable AI systems.",
        "tags": [
          "clippings"
        ]
      },
      "removed_noise_classes": [],
      "manual_review_required": false,
      "manual_review_reasons": []
    },
    {
      "path": "raw/web-snapshots/Asian stocks exodus fuels largest emerging market outflows since 2020, IIF data shows.md",
      "changed": false,
      "frontmatter_present_before": true,
      "pre_sha256": "ac0d51a4d7be054666978be466e2faf47cd99913cc98da426845a0661c9fc8ea",
      "post_sha256": "ac0d51a4d7be054666978be466e2faf47cd99913cc98da426845a0661c9fc8ea",
      "metadata": {
        "title": "Asian stocks exodus fuels largest emerging market outflows since 2020, IIF data shows",
        "source": "https://www.reuters.com/world/china/asian-stocks-exodus-fuels-largest-emerging-market-outflows-since-2020-iif-data-2026-04-08/",
        "author": [
          "[[Libby George]]"
        ],
        "published": "2026-04-08",
        "created": "2026-04-13",
        "description": "Foreign investors pulled $70.3 billion from emerging market assets in March, the biggest outflow since the pandemic rout in March 2020, data from a global banking trade group showed on Wednesday.",
        "tags": [
          "clippings"
        ]
      },
      "removed_noise_classes": [],
      "manual_review_required": false,
      "manual_review_reasons": []
    },
    {
      "path": "raw/web-snapshots/Automated Weak-to-Strong Researcher.md",
      "changed": true,
      "frontmatter_present_before": true,
      "pre_sha256": "6829cca0d6d0c5d8bc35ddf6b7d9c5365466db7b1e4bd1bc7dc57f9d0f30fc78",
      "post_sha256": "2dcefa81ad5706b132e79836085b99b24684e3835b64e97406ae5816c1bab1af",
      "metadata": {
        "title": "Automated Weak-to-Strong Researcher",
        "source": "https://alignment.anthropic.com/2026/automated-w2s-researcher/",
        "author": null,
        "published": "unknown",
        "created": "2026-04-15",
        "description": null,
        "tags": [
          "clippings"
        ]